{
  "id": "card_0153",
  "name": "The Empty Tomb",
  "slug": "the_empty_tomb",
  "setId": "set_messianicfulfillment",
  "typeLine": "Legendary Land",
  "manaCost": null,
  "manaValue": 0,
  "colors": [],
  "colorIdentity": [
    "W"
  ],
  "rarity": "rare",
  "oracleText": "The Empty Tomb enters the battlefield tapped.\n{T}: Add {C}.\n{1}{W}, {T}: Return target creature card with mana value 2 or less from your graveyard to the battlefield tapped.",
  "flavorText": "\"He is not here: for he is risen.\" — Matthew 28:6",
  "power": null,
  "toughness": null,
  "loyalty": null,
  "defense": null,
  "artist": null,
  "image": {
    "type": "placeholder",
    "path": null
  },
  "imagePrompt": null,
  "mechanics": [
    "mana-fixing",
    "graveyard-recursion"
  ],
  "tags": [
    "messianic-fulfillment",
    "new-testament",
    "major-locations",
    "draft"
  ],
  "status": "draft",
  "notes": "Created from a checked Messianic Fulfillment card list item; mechanics, colors, and art sourcing remain pending. Source boundary is anchored to Luke with Matthew, Mark, and John as support material per the Biblical-series timeline guide. First-pass mechanics added in this pass; mana, colors, and rules text remain provisional. Classics theme art uses James Tissot's \"Mary Magdalene and the Holy Women at the Tomb\" via Wikimedia Commons.",
  "createdAt": "2026-03-29T12:00:00-05:00",
  "updatedAt": "2026-03-29T02:04:16-05:00",
  "title": null,
  "images": {
    "classics": {
      "type": "remote",
      "path": "https://commons.wikimedia.org/wiki/Special:FilePath/Brooklyn_Museum_-_Mary_Magdalene_and_the_Holy_Women_at_the_Tomb_%28Madeleine_et_les_saintes_femmes_au_tombeau%29_-_James_Tissot.jpg",
      "artist": "James Tissot",
      "sourceUrl": "https://commons.wikimedia.org/wiki/File:Brooklyn_Museum_-_Mary_Magdalene_and_the_Holy_Women_at_the_Tomb_%28Madeleine_et_les_saintes_femmes_au_tombeau%29_-_James_Tissot.jpg",
      "license": "Public domain; Brooklyn Museum Commons upload marked with no known restrictions.",
      "creditText": "James Tissot, Mary Magdalene and the Holy Women at the Tomb",
      "sourceNotes": "A direct tomb-visitation scene makes this the best classics fit for the empty tomb."
    }
  }
}
