{
  "id": "card_0032",
  "name": "Flaming Sword of the East",
  "slug": "flaming_sword_of_the_east",
  "setId": "set_earlyworld",
  "typeLine": "Artifact - Equipment",
  "manaCost": "{2}",
  "manaValue": 2,
  "colors": [],
  "colorIdentity": [],
  "rarity": "rare",
  "oracleText": "Equipped creature gets +2/+0 and has first strike.\nWhenever equipped creature deals combat damage to a player, exile up to one target card from that player's graveyard.\nEquip {2}",
  "flavorText": "\"A flaming sword which turned every way, to keep the way of the tree of life.\" — Genesis 3:24",
  "power": null,
  "toughness": null,
  "loyalty": null,
  "defense": null,
  "artist": null,
  "image": {
    "type": "local",
    "path": "images/cards/card_0032_flaming_sword_of_the_east.png",
    "artist": "Theodore Poulakis"
  },
  "imagePrompt": null,
  "mechanics": [
    "equipment",
    "first-strike",
    "graveyard-hate"
  ],
  "tags": [
    "early-world",
    "eden",
    "artifact"
  ],
  "status": "draft",
  "notes": "Early World symbolic object card based on the first three entries in the card list batch. Local reference image downloaded from the Wikimedia Commons reusable file page for Expulsion from the Garden of Eden.",
  "createdAt": "2026-03-28T12:12:00-05:00",
  "updatedAt": "2026-03-28T16:45:00-05:00",
  "title": null,
  "images": {
    "classics": {
      "type": "local",
      "path": "images/cards/card_0032_flaming_sword_of_the_east.png",
      "artist": "Theodore Poulakis"
    }
  }
}
