{
  "id": "card_0200",
  "name": "Beetleback Chief",
  "slug": "beetleback_chief",
  "setId": "set_red",
  "typeLine": "Creature - Goblin Warrior",
  "manaCost": "{2}{R}{R}",
  "manaValue": 4,
  "colors": [
    "R"
  ],
  "colorIdentity": [
    "R"
  ],
  "rarity": "uncommon",
  "oracleText": "When this creature enters, create two 1/1 red Goblin creature tokens.",
  "flavorText": null,
  "power": "2",
  "toughness": "2",
  "loyalty": null,
  "defense": null,
  "artist": null,
  "image": {
    "type": "placeholder",
    "path": null
  },
  "imagePrompt": null,
  "mechanics": [
    "tokens"
  ],
  "tags": [
    "starter-deck",
    "red",
    "goblin"
  ],
  "status": "draft",
  "notes": "Imported from the real MTG card Beetleback Chief for the Basics red deck.",
  "createdAt": "2026-04-13T10:20:00-05:00",
  "updatedAt": "2026-04-13T10:20:00-05:00",
  "title": null
}
