{
  "id": "card_0070",
  "name": "Firmament",
  "slug": "firmament",
  "setId": "set_earlyworld",
  "typeLine": "Legendary Land",
  "manaCost": null,
  "manaValue": 0,
  "colors": [],
  "colorIdentity": [],
  "rarity": "mythic",
  "oracleText": "Firmament enters the battlefield tapped.\n{T}: Add {C}.\n{1}, {T}: Scry 2. Activate only if you control five or more lands.",
  "flavorText": "\"And God called the firmament Heaven.\" — Genesis 1:8",
  "power": null,
  "toughness": null,
  "loyalty": null,
  "defense": null,
  "artist": null,
  "image": {
    "type": "placeholder",
    "path": null
  },
  "imagePrompt": null,
  "mechanics": [
    "land",
    "scry",
    "late-game"
  ],
  "tags": [
    "early-world",
    "land",
    "draft"
  ],
  "status": "draft",
  "notes": "Created from a checked Early World card list item; mechanics pending. Classics theme art uses Wenceslas Hollar's \"Creation of the firmament\" via Wikimedia Commons.",
  "createdAt": "2026-03-29T10:01:00-05:00",
  "updatedAt": "2026-03-29T10:01:00-05:00",
  "title": null,
  "images": {
    "classics": {
      "type": "local",
      "path": "images/cards/classics/card_0070_firmament.jpg",
      "artist": "Wenceslaus Hollar"
    }
  }
}
