{
  "id": "card_0207",
  "name": "Titan's Strength",
  "slug": "titans_strength",
  "setId": "set_red",
  "typeLine": "Instant",
  "manaCost": "{R}",
  "manaValue": 1,
  "colors": [
    "R"
  ],
  "colorIdentity": [
    "R"
  ],
  "rarity": "common",
  "oracleText": "Target creature gets +3/+1 until end of turn. Scry 1.",
  "flavorText": null,
  "power": null,
  "toughness": null,
  "loyalty": null,
  "defense": null,
  "artist": null,
  "image": {
    "type": "placeholder",
    "path": null
  },
  "imagePrompt": null,
  "mechanics": [
    "pump",
    "scry"
  ],
  "tags": [
    "starter-deck",
    "red",
    "instant"
  ],
  "status": "draft",
  "notes": "Imported from the real MTG card Titan's Strength for the Basics red deck.",
  "createdAt": "2026-04-13T10:20:00-05:00",
  "updatedAt": "2026-04-13T10:20:00-05:00",
  "title": null
}
