{
  "id": "card_0188",
  "name": "Murder",
  "slug": "murder",
  "setId": "set_basics",
  "typeLine": "Instant",
  "manaCost": "{1}{B}{B}",
  "manaValue": 3,
  "colors": [
    "B"
  ],
  "colorIdentity": [
    "B"
  ],
  "rarity": "common",
  "oracleText": "Destroy target creature.",
  "flavorText": "By fate or by will, every reign must come to an end.",
  "power": null,
  "toughness": null,
  "loyalty": null,
  "defense": null,
  "artist": null,
  "image": {
    "type": "placeholder",
    "path": null
  },
  "imagePrompt": null,
  "mechanics": [
    "destroy"
  ],
  "tags": [
    "starter-deck",
    "black",
    "instant"
  ],
  "status": "draft",
  "notes": "Imported from the real MTG card Murder for the Basics black deck.",
  "createdAt": "2026-04-13T09:40:00-05:00",
  "updatedAt": "2026-04-13T09:40:00-05:00",
  "title": null
}
