{
  "id": "card_0092",
  "name": "James",
  "slug": "james_son_of_thunder",
  "setId": "set_messianicfulfillment",
  "typeLine": "Legendary Creature - Human Cleric",
  "manaCost": "{1}{W}{R}",
  "manaValue": 3,
  "colors": [
    "W",
    "R"
  ],
  "colorIdentity": [
    "W",
    "R"
  ],
  "rarity": "rare",
  "oracleText": "Haste\nWhenever James attacks, he deals 1 damage to any target.\nWhenever you cast your second spell each turn, untap James.",
  "flavorText": "\"He surnamed them Boanerges, which is, The sons of thunder.\" — Mark 3:17",
  "power": "3",
  "toughness": "2",
  "loyalty": null,
  "defense": null,
  "artist": null,
  "image": {
    "type": "placeholder",
    "path": null
  },
  "imagePrompt": null,
  "mechanics": [
    "haste",
    "damage",
    "untap"
  ],
  "tags": [
    "messianic-fulfillment",
    "new-testament",
    "secondary-figures",
    "draft"
  ],
  "status": "draft",
  "notes": "Created from a checked Messianic Fulfillment card list item; first-pass mechanics, mana, colors, and stats added. Source boundary is anchored to Luke with Matthew, Mark, and John as support material per the Biblical-series timeline guide. Classics theme art uses James Tissot's \"The Calling of Saint James and Saint John\" via Wikimedia Commons.",
  "createdAt": "2026-03-29T12:00:00-05:00",
  "updatedAt": "2026-03-29T02:04:16-05:00",
  "title": "Son of Thunder",
  "images": {
    "classics": {
      "type": "remote",
      "path": "https://commons.wikimedia.org/wiki/Special:FilePath/Brooklyn_Museum_-_The_Calling_of_Saint_James_and_Saint_John_%28Vocation_de_Saint_Jacques_et_de_Saint_Jean%29_-_James_Tissot_-_overall.jpg",
      "artist": "James Tissot",
      "sourceUrl": "https://commons.wikimedia.org/wiki/File:Brooklyn_Museum_-_The_Calling_of_Saint_James_and_Saint_John_%28Vocation_de_Saint_Jacques_et_de_Saint_Jean%29_-_James_Tissot_-_overall.jpg",
      "license": "Public domain; Brooklyn Museum Commons upload marked with no known restrictions.",
      "creditText": "James Tissot, The Calling of Saint James and Saint John",
      "sourceNotes": "A calling scene gives James an exact place in the Gospel cohort."
    }
  }
}
