{
  "id": "card_0050",
  "name": "Covenant of the Rainbow",
  "slug": "covenant_of_the_rainbow",
  "setId": "set_earlyworld",
  "typeLine": "Enchantment",
  "manaCost": "{1}{G}{W}",
  "manaValue": 3,
  "colors": [
    "W",
    "G"
  ],
  "colorIdentity": [
    "W",
    "G"
  ],
  "rarity": "rare",
  "oracleText": "When Covenant of the Rainbow enters the battlefield, draw a card.\nCreatures you control have ward {1}.\nAt the beginning of your end step, if you gained life this turn, put a +1/+1 counter on target creature you control.",
  "flavorText": "\"I do set my bow in the cloud, and it shall be for a token of a covenant.\" — Genesis 9:13",
  "power": null,
  "toughness": null,
  "loyalty": null,
  "defense": null,
  "artist": null,
  "image": {
    "type": "placeholder",
    "path": null
  },
  "imagePrompt": null,
  "mechanics": [
    "ward",
    "card-draw",
    "lifegain",
    "counters"
  ],
  "tags": [
    "early-world",
    "flood",
    "draft"
  ],
  "status": "draft",
  "notes": "Created from a checked Early World card list item; mechanics pending. Classics theme art uses the reusable Wikimedia Commons Medhurst rainbow illustration from Genesis 8.",
  "createdAt": "2026-03-29T09:41:00-05:00",
  "updatedAt": "2026-03-29T09:41:00-05:00",
  "title": null,
  "images": {
    "classics": {
      "type": "local",
      "path": "images/cards/classics/card_0050_covenant_of_the_rainbow.jpg",
      "artist": "Jan Luyken"
    }
  }
}
