{
  "id": "card_0152",
  "name": "Golgotha",
  "slug": "golgotha_place_of_the_skull",
  "setId": "set_messianicfulfillment",
  "typeLine": "Legendary Land",
  "manaCost": null,
  "manaValue": 0,
  "colors": [],
  "colorIdentity": [
    "W",
    "B"
  ],
  "rarity": "rare",
  "oracleText": "Golgotha enters the battlefield tapped.\n{T}: Add {W} or {B}.\n{2}, {T}, Sacrifice a creature: Each opponent loses 2 life and you gain 2 life.",
  "flavorText": "\"Father, forgive them; for they know not what they do.\" — Luke 23:34",
  "power": null,
  "toughness": null,
  "loyalty": null,
  "defense": null,
  "artist": null,
  "image": {
    "type": "placeholder",
    "path": null
  },
  "imagePrompt": null,
  "mechanics": [
    "mana-fixing",
    "drain",
    "sacrifice"
  ],
  "tags": [
    "messianic-fulfillment",
    "new-testament",
    "major-locations",
    "draft"
  ],
  "status": "draft",
  "notes": "Created from a checked Messianic Fulfillment card list item; mechanics, colors, and art sourcing remain pending. Source boundary is anchored to Luke with Matthew, Mark, and John as support material per the Biblical-series timeline guide. First-pass mechanics added in this pass; mana, colors, and rules text remain provisional. Classics theme art uses James Tissot's \"What Our Lord Saw from the Cross\" via Wikimedia Commons.",
  "createdAt": "2026-03-29T12:00:00-05:00",
  "updatedAt": "2026-03-29T02:04:16-05:00",
  "title": "Place of the Skull",
  "images": {
    "classics": {
      "type": "remote",
      "path": "https://commons.wikimedia.org/wiki/Special:FilePath/Brooklyn_Museum_-_What_Our_Lord_Saw_from_the_Cross_%28Ce_que_voyait_Notre-Seigneur_sur_la_Croix%29_-_James_Tissot.jpg",
      "artist": "James Tissot",
      "sourceUrl": "https://commons.wikimedia.org/wiki/File:Brooklyn_Museum_-_What_Our_Lord_Saw_from_the_Cross_%28Ce_que_voyait_Notre-Seigneur_sur_la_Croix%29_-_James_Tissot.jpg",
      "license": "Public domain; Brooklyn Museum Commons upload marked with no known restrictions.",
      "creditText": "James Tissot, What Our Lord Saw from the Cross",
      "sourceNotes": "This provides a strong Golgotha-centered view for the place-of-the-skull card."
    }
  }
}
