{
  "id": "card_0030",
  "name": "Tree of Life",
  "slug": "tree_of_life",
  "setId": "set_earlyworld",
  "typeLine": "Legendary Artifact",
  "manaCost": "{3}",
  "manaValue": 3,
  "colors": [],
  "colorIdentity": [],
  "rarity": "mythic",
  "oracleText": "Tree of Life enters the battlefield with three fruit counters on it.\n{T}, Remove a fruit counter from Tree of Life: Add one mana of any color and you gain 1 life.\nWhen the last fruit counter is removed from Tree of Life, sacrifice it.",
  "flavorText": "\"Lest he put forth his hand, and take also of the tree of life, and eat, and live for ever.\" — Genesis 3:22",
  "power": null,
  "toughness": null,
  "loyalty": null,
  "defense": null,
  "artist": null,
  "image": {
    "type": "local",
    "path": "images/cards/card_0030_tree_of_life.jpg",
    "artist": "John Hagerty"
  },
  "imagePrompt": null,
  "mechanics": [
    "mana",
    "lifegain",
    "counters"
  ],
  "tags": [
    "early-world",
    "eden",
    "legendary-artifact"
  ],
  "status": "draft",
  "notes": "Early World symbolic object card based on the first three entries in the card list batch. Local reference image downloaded from the Wikimedia Commons reusable file page for Tree of life in 1791.",
  "createdAt": "2026-03-28T12:10:00-05:00",
  "updatedAt": "2026-03-28T16:45:00-05:00",
  "title": null,
  "images": {
    "classics": {
      "type": "local",
      "path": "images/cards/card_0030_tree_of_life.jpg",
      "artist": "John Hagerty"
    }
  }
}
