{
  "id": "card_0071",
  "name": "Abel",
  "slug": "abel_keeper_of_the_first_flock",
  "setId": "set_earlyworld",
  "typeLine": "Legendary Creature - Human Scout",
  "manaCost": "{W}{G}",
  "manaValue": 2,
  "colors": [
    "W",
    "G"
  ],
  "colorIdentity": [
    "W",
    "G"
  ],
  "rarity": "rare",
  "oracleText": "When Abel enters the battlefield, create a Food token.\nWhenever you sacrifice a token, put a +1/+1 counter on target creature you control.\nWhenever another nontoken creature you control dies, you gain 2 life.",
  "flavorText": "\"And Abel, he also brought of the firstlings of his flock and of the fat thereof.\" — Genesis 4:4",
  "power": "2",
  "toughness": "2",
  "loyalty": null,
  "defense": null,
  "artist": null,
  "image": {
    "type": "placeholder",
    "path": null
  },
  "imagePrompt": null,
  "mechanics": [
    "food",
    "counters",
    "lifegain",
    "death-trigger"
  ],
  "tags": [
    "early-world",
    "abel",
    "draft"
  ],
  "status": "draft",
  "notes": "Created from a checked Early World card list item; mechanics pending. Classics theme reuses the existing Early World Cain and Abel old-master artwork so Abel shares the same foundational scene.",
  "createdAt": "2026-03-29T10:05:00-05:00",
  "updatedAt": "2026-03-29T10:05:00-05:00",
  "title": "Keeper of the First Flock",
  "images": {
    "classics": {
      "type": "local",
      "path": "images/cards/card_0023_cain_marked_exile.jpg",
      "artist": "Titian"
    }
  }
}
