{
  "id": "card_0067",
  "name": "Euphrates",
  "slug": "euphrates_river_of_ancient_boundaries",
  "setId": "set_earlyworld",
  "typeLine": "Legendary Land",
  "manaCost": null,
  "manaValue": 0,
  "colors": [],
  "colorIdentity": [],
  "rarity": "rare",
  "oracleText": "Euphrates, River of Ancient Boundaries enters the battlefield tapped.\n{T}: Add {C}.\n{2}, {T}: Add two mana in any combination of colors. Spend this mana only to cast legendary spells or activate abilities of legendary permanents.",
  "flavorText": "\"And the fourth river is Euphrates.\" — Genesis 2:14",
  "power": null,
  "toughness": null,
  "loyalty": null,
  "defense": null,
  "artist": null,
  "image": {
    "type": "placeholder",
    "path": null
  },
  "imagePrompt": null,
  "mechanics": [
    "land",
    "mana-ramp",
    "legendary-matters"
  ],
  "tags": [
    "early-world",
    "land",
    "draft"
  ],
  "status": "draft",
  "notes": "Created from a checked Early World card list item; mechanics pending. Classics theme art uses the Walters manuscript page \"Fountain of Life and the Four Rivers of Paradise\" via Wikimedia Commons.",
  "createdAt": "2026-03-29T09:58:00-05:00",
  "updatedAt": "2026-03-29T09:58:00-05:00",
  "title": "River of Ancient Boundaries",
  "images": {
    "classics": {
      "type": "local",
      "path": "images/cards/classics/card_0067_euphrates_river_of_ancient_boundaries.jpg",
      "artist": "Dirc van Delf"
    }
  }
}
