{
  "id": "card_0285",
  "name": "Thirst for Discovery",
  "slug": "thirst_for_discovery",
  "setId": "set_blue",
  "typeLine": "Instant",
  "manaCost": "{2}{U}",
  "manaValue": 3,
  "colors": ["U"],
  "colorIdentity": ["U"],
  "rarity": "uncommon",
  "oracleText": "Draw three cards. Then discard two cards unless you discard a basic land card.",
  "flavorText": null,
  "power": null,
  "toughness": null,
  "loyalty": null,
  "defense": null,
  "artist": null,
  "image": {
    "type": "placeholder",
    "path": null
  },
  "imagePrompt": null,
  "mechanics": ["card-draw", "loot"],
  "tags": ["starter-deck", "blue", "instant"],
  "status": "draft",
  "notes": "Imported from the real MTG card Thirst for Discovery for the Basics blue deck.",
  "createdAt": "2026-04-13T11:25:00-05:00",
  "updatedAt": "2026-04-13T11:25:00-05:00",
  "title": null
}
