{
  "id": "card_0002",
  "name": "Sarah",
  "slug": "sarah_laughter_of_promise",
  "setId": "set_genesis",
  "typeLine": "Legendary Creature - Human Noble",
  "manaCost": null,
  "manaValue": null,
  "colors": [],
  "colorIdentity": [
    "W"
  ],
  "rarity": null,
  "oracleText": null,
  "flavorText": "Joy arrived so late it sounded impossible at first.",
  "power": null,
  "toughness": null,
  "loyalty": null,
  "defense": null,
  "artist": null,
  "image": {
    "type": "placeholder",
    "path": null
  },
  "imagePrompt": null,
  "mechanics": [
    "tokens",
    "lifegain"
  ],
  "tags": [
    "patriarch",
    "draft"
  ],
  "status": "draft",
  "notes": "Deliberately left mechanically incomplete to exercise draft-stage placeholder rules.",
  "createdAt": "2026-03-27T20:35:00-05:00",
  "updatedAt": "2026-03-27T20:35:00-05:00",
  "title": "Laughter of Promise"
}
