{
  "id": "card_0274",
  "name": "Consider",
  "slug": "consider",
  "setId": "set_blue",
  "typeLine": "Instant",
  "manaCost": "{U}",
  "manaValue": 1,
  "colors": ["U"],
  "colorIdentity": ["U"],
  "rarity": "common",
  "oracleText": "Surveil 1.\nDraw a card.",
  "flavorText": null,
  "power": null,
  "toughness": null,
  "loyalty": null,
  "defense": null,
  "artist": null,
  "image": {
    "type": "placeholder",
    "path": null
  },
  "imagePrompt": null,
  "mechanics": ["surveil", "card-draw"],
  "tags": ["starter-deck", "blue", "instant"],
  "status": "draft",
  "notes": "Imported from the real MTG card Consider for the Basics blue deck.",
  "createdAt": "2026-04-13T11:25:00-05:00",
  "updatedAt": "2026-04-13T11:25:00-05:00",
  "title": null
}
